"9DS25PVB","journalArticle","2001","Perry, William","Incremental validity of the Ego Impairment Index: A re-examination of Dawes (1999).","Psychological Assessment","","1939-134X(Electronic),1040-3590(Print)","10.1037/1040-3590.13.3.403","","This article examined the incremental validity of the Ego Impairment Index (EII), a Rorschach measure of cognition, perception, and reasoning. R. M. Dawes (1999) borrowed 2 previously published data sets to assess the incremental validity of the EII. Dawes determined that in order for the EII to be considered a valid measure, the overall EII score should ""outperform"" 2 of the variables that compose the index. Using this approach, Dawes reported that the EII had ""deficient"" (p = .059) incremental validity. In this study, the incremental validity of the EII was re-examined using 1 of the data sets used by R. M. Dawes (1999). Applying the same strategy as Dawes, the author tested the incremental validity of the EII in predicting positive symptoms of schizophrenia, a more appropriate and clinically relevant criterion measure of impairment. The EII significantly predicted positive symptoms (p < .005) even after the 2 EII variables selected by Dawes and the measure of social competence were 1st entered into the equation. The results suggest that the EII adds meaningful information in the assessment of thought disturbance. (PsycInfo Database Record (c) 2020 APA, all rights reserved)","2001","2023-02-14 17:04:19","2023-02-14 17:04:19","","403-407","","","13","","","","","","","","","","","","","","","","","Place: US Publisher: American Psychological Association","","","","*Ego Development; *Methodology; *Rorschach Test; *Test Interpretation; *Test Validity; Incremental Validity","","","","","","","","","","","","","","","","","","","","","","","","","","","","","","","","","","","","","","","","","","","","","","",""
"692CH6US","journalArticle","2001","Dawes, Robyn M.","Incremental validity of the Ego Impairment Index: It's fine when it's there.","Psychological Assessment","","1939-134X(Electronic),1040-3590(Print)","10.1037/1040-3590.13.3.408","","The results published by W. Perry (2001) demonstrate that with a different criterion more incremental validity can be achieved with the Ego Impairment Index than R. M. Dawes (1999) found using the criterion available to him. Attempting to find statistical rationale for various Rorschach characteristics is, indeed, desirable, especially as a basis for the statistical use of the test. The degree of predictability indicated by most of these statistics, however, still presents a sizable gap between well established validity and much practice, particularly in legal settings. Further, both W. Perry (2001) and D. J. Vighone and M. J. Hilsonroth (2001) raise the issue of evaluating incremental validity in a context where there is some degree of multicolinearity and nesting. The logical equivalence of a nested with a non-nested analysis is established algebraically, and it is noted that the standard concerns about multicolinearity involve the estimations of the coefficients of predictive models—not the degree of predictability per se. (PsycInfo Database Record (c) 2020 APA, all rights reserved)","2001","2023-02-14 17:04:19","2023-02-14 17:04:19","","408-409","","","13","","","","","","","","","","","","","","","","","Place: US Publisher: American Psychological Association","","","","*Ego Development; *Methodology; *Rorschach Test; *Test Interpretation; *Test Validity; Incremental Validity","","","","","","","","","","","","","","","","","","","","","","","","","","","","","","","","","","","","","","","","","","","","","","",""
"6V6CURQT","journalArticle","1993","Coleman, Michael J.; Carpenter, J. Tyler; Waternaux, Christine; Levy, Deborah L.; Shenton, Martha E.; Perry, Jonathan; Medoff, David; Wong, Hazel; Monoach, Dara; Meyer, Patricia; O'Brian, Carita; Valentino, Camille; Robinson, Delbert; Smith, Melissa; Makowski, David; Holzman, Philip S.","The Thought Disorder Index: A reliability study.","Psychological Assessment","","1939-134X(Electronic),1040-3590(Print)","10.1037/1040-3590.5.3.336","","Reports interrater reliability among 4 teams of raters who independently evaluated thought disorder in 20 Rorschach protocols using the Thought Disorder Index. Intraclass correlation coefficients were calculated to assess the degree of association among the 4 items for total thought disorder scores, severity levels, and qualitative thought disorder factors. Highly acceptable agreement was obtained. Spearman rank order correlation coefficients for these same variables were significant for all possible pairings of teams. A repeated-measures ANOVA indicated that the absolute amount of thought disorder tagged by each team differed even though the teams' relative rankings of thought disorder among Ss was very similar. Such scoring differences reflect individual differences in threshold for detecting deviant thinking. (PsycInfo Database Record (c) 2022 APA, all rights reserved)","1993","2023-02-14 17:04:19","2023-02-14 17:04:19","","336-342","","","5","","","","","","","","","","","","","","","","","Place: US Publisher: American Psychological Association","","","","*Interrater Reliability; *Measurement; *Rorschach Test; Thought Disorders","","","","","","","","","","","","","","","","","","","","","","","","","","","","","","","","","","","","","","","","","","","","","","",""
"P6A6U3KN","journalArticle","1995","Hibbard, Stephen; Hilsenroth, Mark J.; Hibbard, Juliette Klepser; Nash, Michael R.","A validity study of two projective object representations measures.","Psychological Assessment","","1939-134X(Electronic),1040-3590(Print)","10.1037/1040-3590.7.4.432","","Two projective measures of object representations, the Concept of the Object on the Rorschach (H. Rorchach, 1942) and the Social Cognition and Object Relations Scales (D. Westen, 1993) were compared with each other, with measures of intelligence (Wechsler Adult Intelligence Scale—Revised; D. Wechsler, 1981), and measures of pathology (Millon Clinical Multiaxial Inventory [T. Millon, 1983], Minnesota Multiphasic Personality Inventory [S. R. Hathaway & J. McKinley, 1983] Axis 11 diagnoses). Analyses focused on the construct validity of object representations and the implications of structural and affective aspects of object representations for psychopathology. Results support the construct validity of object representations and an affective, but not a cognitive–structural, linkage between object representations and pathology. (PsycINFO Database Record (c) 2019 APA, all rights reserved)","1995","2023-02-14 17:04:19","2023-02-14 17:04:19","","432-439","","","7","","","","","","","","","","","","","","","","","Place: US Publisher: American Psychological Association","","","","*Object Relations; *Projective Personality Measures; *Psychiatric Patients; *Social Cognition; *Statistical Validity; Construct Validity","","","","","","","","","","","","","","","","","","","","","","","","","","","","","","","","","","","","","","","","","","","","","","",""
"TQCGFT68","journalArticle","1997","Leavitt, Frank; Labott, Susan M.","Criterion-related validity of Rorschach analogues of dissociation.","Psychological Assessment","","1939-134X(Electronic),1040-3590(Print)","10.1037/1040-3590.9.3.244","","The validity of Rorschach indicators of dissociation was evaluated using scores on the Dissociative Experiences Scale (DES) as the standard. Results indicated that participants with Rorschach indicators of dissociation scored significantly higher on the DES than did those without the indicators. Also, incremental changes from 0 to 1 and 1 to 2 Rorschach indicators were associated with increased dissociation as measured by the DES. Viewed from DES measurement of dissociation, Rorschach analogues of dissociation identified a distinctive group that is characterized by strong dissociative tendencies and did not tap the less intense dissociative phenomena common to general psychiatric populations and to nonclinical samples. The Rorschach indicators of dissociation were able to be scored reliably and remained stable at retest. As indirect measures, Rorschach indicators are less subject to distortions stemming from defensiveness or tendencies to manipulate. (PsycINFO Database Record (c) 2016 APA, all rights reserved)","1997","2023-02-14 17:04:19","2023-02-14 17:04:19","","244-249","","","9","","","","","","","","","","","","","","","","","Place: US Publisher: American Psychological Association","","","","*Dissociative Disorders; *Dissociative Identity Disorder; *Rating Scales; *Rorschach Test; Test Validity","","","","","","","","","","","","","","","","","","","","","","","","","","","","","","","","","","","","","","","","","","","","","","",""
"VIHI87I3","journalArticle","2001","Weiner, Irving B.","Advancing the science of psychological assessment: The Rorschach Inkblot Method as exemplar.","Psychological Assessment","","1939-134X(Electronic),1040-3590(Print)","10.1037/1040-3590.13.4.423","","This article comments on a series of 5 articles, concerning the utility of the Rorschach Inkblot Method (RTM; R. M. Dawes, see record 1999-11130-006; J. Hiller et al, see record 1999-11130-005; J. Hunsley and J. M. Bailey, see record 1999-11130-004; G. Stricker and J. R. Gold, see record 1999-11130-002; and D. J. Vigilone, see record 1999-11130-003). Two of the articles provide extensive empirical evidence that the RIM has been standardized, normed, made reliable, and validated in ways that exemplify sound scientific principles for developing an assessment instrument. A 3rd article reports a meta-analysis, indicating that the RIM and the Minnesota Multiphasic Personality Inventory have almost identical validity effect sizes, both large enough to warrant confidence in using these measures. The other 2 articles adduce sketchy data and incomplete literature reviews as a basis for questioning the psychometric soundness of Rorschach assessment. Unwarranted skepticism should not be given credence as an adequate platform from which to challenge abundant evidence that the RIM works very well for its intended purposes. (PsycINFO Database Record (c) 2016 APA, all rights reserved)","2001","2023-02-14 17:04:19","2023-02-14 17:04:19","","423-432","","","13","","","","","","","","","","","","","","","","","Place: US Publisher: American Psychological Association","","","","*Psychological Assessment; *Rorschach Test; *Test Reliability; *Test Validity; Minnesota Multiphasic Personality Inventory","","","","","","","","","","","","","","","","","","","","","","","","","","","","","","","","","","","","","","","","","","","","","","",""
"KZTJRX57","journalArticle","2001","Rosenthal, Robert; Hiller, Jordan B.; Bornstein, Robert F.; Berry, David T. R.; Brunell-Neuleib, Sherrie","Meta-analytic methods, the Rorschach, and the MMPI.","Psychological Assessment","","1939-134X(Electronic),1040-3590(Print)","10.1037/1040-3590.13.4.449","","In response to concerns described by H. N. Garb et al(see record 2001-05665-003), the authors present the weighted and unweighted means and medians of the effect sizes obtained by J. B. Hiller et al (see record 1999-11130-005). These indices of central tendency are presented separately for MMPI and Rorschach effect sizes, both for all the studies in the meta-analysis and for a 10% trimmed sample designed to obtain more robust estimates of central tendency. The variability of these 4 indices is noticeably greater for the MMPI than for the Rorschach. Meta-analysts must compute, compare, and evaluate a variety of indices of central tendency, and they must examine the effects of moderator variables. The authors also comment briefly on the use of phi versus kappa, combining correlated effect sizes and possible hindsight biases. (PsycINFO Database Record (c) 2016 APA, all rights reserved)","2001","2023-02-14 17:04:19","2023-02-14 17:04:19","","449-451","","","13","","","","","","","","","","","","","","","","","Place: US Publisher: American Psychological Association","","","","*Psychological Assessment; *Rorschach Test; *Test Reliability; *Test Validity; Minnesota Multiphasic Personality Inventory","","","","","","","","","","","","","","","","","","","","","","","","","","","","","","","","","","","","","","","","","","","","","","",""
"6YDSFVFL","journalArticle","2003","Perry, William","Let's Call the Whole Thing Off: A Response to Dawes (2001).","Psychological Assessment","","1939-134X(Electronic),1040-3590(Print)","10.1037/1040-3590.15.4.582","","There has been a recent controversy regarding the validity of the Rorschach test. This comment is in response to criticism levied by R. M. Dawes (2001; see record 2001-18200-013) on the incremental validity of the Ego Impairment Index (EII), a Rorschach-derived measure of cognition, perception, and reasoning. The Dawes articles (1999 and 2001) serve as an example of the recent practice of placing extraordinary challenges on the Rorschach test. Dawes's arguments are examined and parallel examples are provided that demonstrate the bias used to judge the validity of the EII, the Rorschach, and psychological assessment. Still, in the face of criticism, the results (see Dawes, 2001) support the incremental validity of the EII. Thus, the conclusion presented in this Comment is that it is time for us to ""call the whole thing off"" and end the Rorschach controversy that has occupied so much recent attention and generated so few new ideas. (PsycInfo Database Record (c) 2020 APA, all rights reserved)","2003","2023-02-14 17:04:19","2023-02-14 17:04:19","","582-585","","","15","","","","","","","","","","","","","","","","","Place: US Publisher: American Psychological Association","","","","*Incremental Validity; *Rorschach Test; *Test Validity; Ego","","","","","","","","","","","","","","","","","","","","","","","","","","","","","","","","","","","","","","","","","","","","","","",""
"GRAPDTUW","journalArticle","1997","Hilsenroth, Mark J.; Fowler, J. Christopher; Padawer, Justin R.; Handler, Leonard","Narcissism in the Rorschach revisited: Some reflections on empirical data.","Psychological Assessment","","1939-134X(Electronic),1040-3590(Print)","10.1037/1040-3590.9.2.113","","This study investigates the extent to which the Rorschach was able to identify accurately pathological expressions of narcissism according to the methodological recommendations offered by T. Nezworski and J. Wood (1995) . Ninety-one patients who were found to meet DSM-IV criteria for an Axis II disorder (Cluster A personality disorders/&=/&10; antisocial/&=/&20, borderline/&=/&25, histrionic/&=/&5, narcissistic [NPD]/&=/&15; Cluster C personality disorders/&=/&16) and 50 nonclinical participants were compared on 5 Rorschach variables: reflection, pair, personalization, idealization, and the egocentricity index. The results of this study indicate that selected Rorschach variables can be used effectively to differentiate NPD patients from a nonclinical sample and from Cluster A, Cluster C, and other Cluster B personality disorders. Also, the reflection and idealization variables were found to be empirically related to DSM-IV diagnostic criteria for NPD and a self-report measure of NPD. Finally, these 2 variables could be used for classification purposes in ways that were clinically meaningful in the diagnosis of NPD. (PsycINFO Database Record (c) 2016 APA, all rights reserved)","1997","2023-02-14 17:04:20","2023-02-14 17:04:20","","113-121","","","9","","","","","","","","","","","","","","","","","Place: US Publisher: American Psychological Association","","","","*Narcissistic Personality Disorder; *Psychodiagnosis; Rorschach Test","","","","","","","","","","","","","","","","","","","","","","","","","","","","","","","","","","","","","","","","","","","","","","",""
"EDWR8XY4","journalArticle","1996","Bornstein, Robert F.","Construct validity of the Rorschach Oral Dependency Scale: 1967–1995.","Psychological Assessment","","1939-134X(Electronic),1040-3590(Print)","10.1037/1040-3590.8.2.200","","A review of research examining the construct validity of J. M. Masling, L. Rabie, and S. H. Blondheim's (1967) Rorschach Oral Dependency (ROD) scale as a measure of interpersonal dependency revealed that this scale has demonstrated good interrater reliability, and that evidence regarding the convergent and discriminant validity of the ROD scale is generally strong. Mixed results have been obtained in studies assessing the internal reliability of ROD scale scores. There have been very few studies examining the predictive validity and retest reliability of the ROD scale, and few studies assessing the relationship of ROD scores to scores on other objective and projective measures of dependency. Implications of these findings for laboratory and clinical research involving the ROD scale are discussed, and suggestions for future studies in this area are offered. (PsycINFO Database Record (c) 2019 APA, all rights reserved)","1996","2023-02-14 17:04:20","2023-02-14 17:04:20","","200-205","","","8","","","","","","","","","","","","","","","","","Place: US Publisher: American Psychological Association","","","","*Dependency (Personality); *Literature Review; *Rating Scales; *Rorschach Test; *Statistical Validity; Construct Validity; Test Reliability","","","","","","","","","","","","","","","","","","","","","","","","","","","","","","","","","","","","","","","","","","","","","","",""